"New Balance 574 PS Boys Shoes Size 1, Color: Grey/Red/White",,,$64.90,,$64.90,$64.90,,,,B0CZF1FD62,196432554317,196432554317,,New Balance,,3rd Party (A8J09E2FDMZCY),Y,none
"New Balance 574 PS Boys Shoes Size 3, Color: Grey/Red/White",,,$64.90,,$64.90,$64.90,,,,B0CZDYWC7R,196432554355,196432554355,,New Balance,,3rd Party (A8J09E2FDMZCY),Y,none
"Steve Madden Women's Hayle Ankle Boot, Black/Olive, 7.5",,,$59.98,,$54.99,$61.99,,,,B0CBNKNQDN,196361763194,196361763194,B0BFZVF4Y1,Steve Madden,,3rd Party (A1XZ3PFSGU10KM),Y,none
"Cole Haan Men's 5.Zerogrand Work Chukka Boot, Black/Black Water-Resistant, 9",,,,,$263.95,$266.95,,,,B0BQT4S7JZ,196414245981,196414245981,B0BQTC7DMR,Cole Haan,,,Y,none
"Cole Haan Men's 5.Zerogrand Work Chukka Boot, Morel/Scarab/Ivory Water-Resistant, 9.5",,,$135.31,,$135.31,$248.00,,,,B0BQT1RSQS,196414246117,196414246117,B0BQTC7DMR,Cole Haan,,3rd Party (AUTFUZM21LT4F),Y,none
"Cole Haan Women's Anica Lux Buckle Flat Sandal, Black Leather, 5",,,$150.00,,$150.00,$150.00,,,,B0CBCN46K1,196414471731,196414471731,B0CFZNM1XP,Cole Haan,,3rd Party (AH1YFAUS3NHX2),Y,none
"Cole Haan Men's Modern Essentials Plain Toe Ox Oxford, Black, 10 Wide",,,$154.63,,$154.63,$170.00,,,,B0BPXVC2WC,196414313277,196414313277,B0CTTVHHRJ,Cole Haan,,3rd Party (AH1YFAUS3NHX2),Y,none
"Steve Madden Women's Kenley Heeled Sandal, Citron, 5.5",,,$33.79,,$21.59,$129.00,,,,B08XPBV85Y,195189746389,195189746389,B096WSTG2P,Steve Madden,,3rd Party (A24V851RG6UNB7),Y,none
"Cole Haan Men's Grand Laser Bit Driver Driving Style Loafer, Navy Blazer/Black, 8",,,,,$125.27,$234.99,,,,B0CB9GPSV9,196414454406,196414454406,B0CB9JTPJF,Cole Haan,,,Y,none
"Cole Haan Men's Grand Laser Bit Driver Driving Style Loafer, Irish Coffee Nubuck/Truffle, 10.5 Wide",,,,,$166.37,$234.99,,,,B0CB9DW3Z2,196414453973,196414453973,B0CB9JTPJF,Cole Haan,,,Y,none
"New Balance Men's Minimus TR V1 BOA Cross Trainer, White/Black, 11",,,$149.99,,$149.99,$149.99,,,,B0C34WLXXZ,197375604985,197375604985,B0C35GZNM3,New Balance,,3rd Party (AH1YFAUS3NHX2),Y,none
"Steve Madden Women's Calypso Sneaker, Black Leather, 10",,,,,$119.95,$119.95,,,,B0CBQRB8LK,197369713365,197369713365,B0CBQX2P8W,Steve Madden,,,Y,none
"Cole Haan Men's Generation Zerogrand Stitchlite High-Top WR Hiking Shoe, Deep Olive/Black, 8.5 Wide",,,$83.60,,$83.60,$160.00,,,,B0BPXN9YNG,196414256680,196414256680,B0BPXNDZHH,Cole Haan,,3rd Party (A2BMBHD2OU3XDU),Y,none
"Cole Haan Men's Generation Zerogrand Stitchlite High-Top WR Hiking Shoe, Deep Olive/Black, 11.5",,,$88.91,,$88.91,$210.19,,,,B0BPXLC41C,196414252859,196414252859,B0BPXNDZHH,Cole Haan,,3rd Party (APV6T4RKTKPW0),Y,none
"Cole Haan Men's Grand Laser Bit Driver Driving Style Loafer, Irish Coffee Nubuck/Truffle, 8",,,,,$166.37,$234.99,,,,B0CB9FSP54,196414453928,196414453928,B0CB9JTPJF,Cole Haan,,,Y,none
Classic Pack Green,,,$89.95,,$89.95,$89.95,,,,B07DJ2J1SQ,192662418603,192662418603,B0886DZFSC,New Balance,,3rd Party (A2KBJ0KLRTKV0Y),Y,none
"Cole Haan Men's Original Grand Shortwing Oxford, Dark Chocolate Saffiano/Black, 9",,,,,$169.76,$170.00,,,,B0BYLNY4D6,196414363111,196414363111,B0BPXSYK4M,Cole Haan,,,Y,none
"Steve Madden Men's Vallme Penny Loafer, Black, 13",,,$69.99,,$69.99,$69.99,,,,B0CK6521M3,197116375372,197116375372,B0CVFNZT2F,Steve Madden,,3rd Party (AH1YFAUS3NHX2),Y,none
"New Balance Baby Girls' Socks - 12 Pack Cushion Quarter Cut Socks Socks (Infant/Toddler), Size 2T-4T, Black Highlight",,,$13.99,,$13.99,$24.99,,,,B0CL7YDZCT,886028509790,886028509790,B0C5436YHW,New Balance,,3rd Party (A2XHA54ZKL7PGW),Y,none
"Steve Madden Women's Amily Flat Sandal, Bronze Rhinestone, 11",,,$69.95,,$69.95,$79.96,,,,B0CHT62Z56,196829351901,196829351901,B0B6GWF9WD,Steve Madden,,3rd Party (A2NEM58BFPMEIL),Y,none
"COLE HAAN Women's GRANDPRØ Rally Fisherman Sandal, Bleached TAN, 9",,,,,$98.00,$141.07,,,,B0BRWF8D3F,196414125801,196414125801,B0CH1CTJQV,Cole Haan,,,Y,none
"New Balance Girls' Skirt Set - 2 Piece Performance Short Sleeve T-Shirt and Skort (Size: 7-16), Size 10-12, Orbit Pink Rib",,,$19.95,,$19.95,$19.99,,,,B0CK3PW2YT,195187857469,195187857469,B0BWK992WF,New Balance,,3rd Party (A2AFJ1SJWF3R1X),Y,none
"Cole Haan Women's Cloudfeel Hampton Sandals Espadrille Wedge, Soft Gold Leather/Natural Canvas, 7.5",,,,,,$170.00,,,,B0CBCRDZF4,196414494808,196414494808,B0CFZW4FZN,Cole Haan,,,Y,none
"Cole Haan Women's Cloudfeel Hampton Sandals Espadrille Wedge, Ivory Leather/Natural Canavs, 7.5",,,,,,$170.00,,,,B0CBCRJTKH,196414492200,196414492200,B0CFZW4FZN,Cole Haan,,,Y,none
"New Balance Women's Fresh Foam 1080 V10 Running Shoe, Steel/Magnetic Blue, 5.5 Wide",,,,,$151.23,$159.99,,,,B0815VFVZJ,194389991728,194389991728,B093V8SYR4,New Balance,,,Y,none
"Steve Madden Girls' Shirt - Casual Short Sleeve Fashion Logo T-Shirt for Girls - Kids' Graphic Tee - Youth Top (4-16), Size 5, Medium Grey",,,$9.95,,$9.95,$16.95,,,,B0CL8HGKHY,886785795757,886785795757,B0CL7XCX1G,Steve Madden,,3rd Party (A3PZV6ZWT70VF6),Y,none
"Cole Haan Women's Fawn Flat Sandal, Black Leather, 11",,,$90.00,,$67.42,$90.00,,,,B0CBCS59L4,196414441055,196414441055,B0CFZQQHLP,Cole Haan,,3rd Party (AH1YFAUS3NHX2),Y,none
"Steve Madden Women's Indulge Heeled Sandal, Black, 6.5",,,$109.95,,$109.95,$109.95,,,,B0C6RB5BPL,197369639863,197369639863,B0C6RJZFYT,Steve Madden,,3rd Party (AH1YFAUS3NHX2),Y,none
"New Balance 508 - Brandon Westgate Indigo/Tan US Men's 7, Women's 8.5 Medium",,,$84.99,,$84.99,$84.99,,,,B0CN35VBCM,197375678238,197375678238,B08RY1TGZT,New Balance,,3rd Party (AH1YFAUS3NHX2),Y,none
"Cole Haan Women's Calli Single Band Sandal, Pecan Leather, 5",,,$99.99,,$99.99,$150.00,,,,B0CLF7S6GD,196414502213,196414502213,B0CLFNPQGM,Cole Haan,,3rd Party (AH1YFAUS3NHX2),Y,none
"Cole Haan Men's Pinch Weekender Penny Loafer, British Tan/Angora, 7.5",,,$148.95,,$130.00,$150.95,,,,B0CB9GFVHZ,196414409383,196414409383,B0CB9JRXZX,Cole Haan,,3rd Party (A1C6SHUL08OHRJ),Y,none
"Cole Haan Men's Pinch Weekender Penny Loafer, British Tan/Angora, 11",,,$130.00,,$130.00,$130.00,,,,B0CB9DQVF7,196414409338,196414409338,B0CB9JRXZX,Cole Haan,,3rd Party (APV6T4RKTKPW0),Y,none
"Steve Madden Women's Pepe30 Slide Sandal, Natural Leather, 6",,,,,,$109.99,,,,B08SKK7JM8,195945044049,195945044049,B0CLJM5DR9,Steve Madden,,,Y,none
"Steve Madden Men's Vallme Penny Loafer, Black, 8",,,$69.99,,$69.99,$69.99,,,,B0CK65JSS4,197116375198,197116375198,B0CVFNZT2F,Steve Madden,,3rd Party (AH1YFAUS3NHX2),Y,none
"Cole Haan Men's Grand Laser Bit Driver Driving Style Loafer, Irish Coffee Nubuck/Truffle, 9 Wide",,,,,$166.37,$234.99,,,,B0CB9H5SG1,196414454062,196414454062,B0CB9HFJDG,Cole Haan,,,Y,none
"Cole Haan Men's Grand Laser Bit Driver Driving Style Loafer, Irish Coffee Nubuck/Truffle, 8.5",,,$166.37,,$166.37,$234.99,,,,B0CB9H8VY8,196414453935,196414453935,B0CB9HFJDG,Cole Haan,,3rd Party (AJNSDDEKL0MDQ),Y,none
"New Balance Men's Nitrel V3 Trail Running Shoe, Henna/Coral Glow, 7 XW US",,,$95.24,,$95.24,$103.53,,,,B07HG4L4DD,193362287841,193362287841,B093YPRSH2,New Balance,,3rd Party (A29RMC3T65YEFQ),Y,none
"New Balance Women's Fresh Foam Garoé V1 Trail Running Shoe, Sea Salt/Linen/Cork, 8",,,,,$168.09,$168.09,,,,B0C29NB5PC,197375462530,197375462530,B0BQC86PVL,New Balance,,,Y,none
"Cole Haan Women's Originalgrand Platform Slides Flat Sandal, Sandollar/Ivory, 6.5",,,$164.95,,$164.95,$166.95,,,,B0CBCTPX49,196414418958,196414418958,B0CFZLXL8S,Cole Haan,,3rd Party (A1C6SHUL08OHRJ),Y,none
"Steve Madden Womens Andiee Leather Tall Knee-High Boots Black 11 Medium (B,M)",,,$88.18,,$72.99,$176.98,,,,B0BYFVR27K,196361904276,196361904276,B0C67LBDVZ,Steve Madden,,3rd Party (A24V851RG6UNB7),Y,none
"New Balance Men's Fresh Foam X Lav V2 Hard Court Tennis Shoe, Raw Sugar/Neon Dragonfly/Black, 7 Wide",,,,,,$149.99,,,,B09YGQDJDQ,196432975440,196432975440,B0BMGMWHRT,New Balance,,,Y,none
"Steve Madden Womens Tessy Leather Cowboy, Western Boots White 9 Medium (B,M)",,,$98.98,,$98.98,$130.18,,,,B0CGW378WY,196361756653,196361756653,B0CGH53GVX,Steve Madden,,3rd Party (ACTZ4HD4YIH8O),Y,none
"Steve Madden Women's Alaya Heeled Sandal, Black Croc, 10",,,$78.36,,$65.99,$99.95,,,,B0BRTC5LPZ,197369007624,197369007624,B0C65X5SY2,Steve Madden,,3rd Party (A24V851RG6UNB7),Y,none
"New Balance Men's Fresh Foam 3000 V6 Mid-Molded Baseball Shoe, Black/White, 14",,,,,,$99.95,,,,B09YGXK2VT,196307391498,196307391498,B09YGMM8MH,New Balance,,,Y,none
"Cole Haan Men's Generation Zerogrand Stitchlite High-Top WR Hiking Shoe, Deep Olive/Black, 7.5 Wide",,,$83.83,,$83.83,$160.00,,,,B0BPXVYGB6,196414256666,196414256666,B0BPXNDZHH,Cole Haan,,3rd Party (A2BMBHD2OU3XDU),Y,none
"Cole Haan Women's Cloudfeel Southcrest Mule Sandal, Blue Wing Teal Suede, 9.5",,,$109.99,,$109.99,$109.99,,,,B0CLFGJBJX,196414505504,196414505504,B0CLFFSDT6,Cole Haan,,3rd Party (AH1YFAUS3NHX2),Y,none
"Steve Madden West Brown Leather Midcalf Western Details Block Heel Pull On Boots (Brown Leather, 7.5)",,,,,$79.95,$199.95,,,,B09KBZCXJF,195945885000,195945885000,B09L131Q3Y,Steve Madden,,,Y,none
"New Balance 997R Dolce/Sandstone US Men's 11.5, Women's 13 D (M)",,,$99.99,,$99.95,$99.99,,,,B0CN32SS3B,197375734378,197375734378,B0CN3G6JJJ,New Balance,,3rd Party (AH1YFAUS3NHX2),Y,none
"New Balance 997R Dolce/Sandstone US Men's 12, Women's 13.5 D (M)",,,$99.99,,$99.95,$99.99,,,,B0CN34RWSL,197375734385,197375734385,B0CN3G6JJJ,New Balance,,3rd Party (AH1YFAUS3NHX2),Y,none
"New Balance Women's Fresh Foam 880v10, Carolina/Moondust, 5.5 Wide",,,$88.00,,$88.00,$129.99,,,,B086JBWCVB,193684999422,193684999422,B08FTY8349,New Balance,,3rd Party (A2SK59Z72PZ6UM),Y,none
"New Balance Girls' Jogger Set - 2 Piece Fleece Hoodie and Joggers Kids Clothing Set (5-16), Size 1012, Rose",,,$39.95,,$39.95,$45.99,,,,B0CXK8JTQG,195187896734,195187896734,B095KST79F,New Balance,,3rd Party (A2AFJ1SJWF3R1X),Y,none
"Cole Haan Women's Originalgrand Platform Slides Flat Sandal, Sandollar/Ivory, 7",,,,,,$234.99,,,,B0CBCSGMX3,196414418965,196414418965,B0CFZLXL8S,Cole Haan,,,Y,none
"New Balance 440 Trail Olive/Black US Men's 5.5, Women's 7 Medium",,,,,$189.99,$189.99,,,,B0C72H77YR,196652857847,196652857847,B0BCZ5LGQZ,New Balance,,,Y,none
"New Balance 440 Trail Olive/Black US Men's 10.5, Women's 12 Medium",,,,,,$124.95,,,,B0C72GSMTG,196652857946,196652857946,B0BCZ5LGQZ,New Balance,,,Y,none
"Steve Madden Women's Polly Heeled Sandal, Silver, 6.5",,,,,,$99.95,,,,B0BDNDN8DN,196829569962,196829569962,B0BFR3PDSY,Steve Madden,,,Y,none
"New Balance Men's 550 Sneakers, White/Dark Olivine, 8 Medium US",,,$109.99,,$109.99,$140.40,,,,B0C9VQ37YF,197376291023,197376291023,B0CVLJP79F,New Balance,,3rd Party (A38XYVTNERCEZ1),Y,none
"Cole Haan Men's Grand Laser Bit Driver Driving Style Loafer, Irish Coffee Nubuck/Truffle, 10.5",,,,,$166.37,$234.99,,,,B0CB9G6VQD,196414453850,196414453850,B0CB9HFJDG,Cole Haan,,,Y,none
"New Balance Girls' Active Shorts Set - 3 Piece Performance T-Shirt, Tank Top, and Gym Shorts - Summer Outfit for Girls (7-12), Size 10-12, PinkWhiteBlack",,,$24.99,,$24.99,$29.99,,,,B0CXF8YVMZ,195187870208,195187870208,B0CXFCLF7R,New Balance,,3rd Party (A2AFJ1SJWF3R1X),Y,none
"Steve Madden Women's Eiffel Ankle Boot, Camel Suede, 9",,,$117.99,,$117.99,$146.12,,,,B0C34YVJ6C,197369517505,197369517505,B0C26X3954,Steve Madden,,3rd Party (A3V17JP5RCORRR),Y,none
"Steve Madden Women's Sandria Flat Sandal, Red Patent, 9.5",,,$109.95,,$109.95,$109.95,,,,B0CTD7MWXY,198024445119,198024445119,B0CTDKR535,Steve Madden,,3rd Party (AH1YFAUS3NHX2),Y,none
"Cole Haan Men's Grand Atlantic Chelsea Boot, EARTHEN Nubuck/Ivory Water Resistant, 11",,,,,$183.28,$184.03,,,,B0BPW7YY4G,196414262704,196414262704,B0BPVTQX9V,Cole Haan,,,Y,none
Steve Madden Landen Black Nubuck 8.5 D (M),,,$69.99,,$69.99,$69.99,,,,B0C9ZXWGQ9,197116052877,197116052877,B099F9J5KT,Steve Madden,,3rd Party (AH1YFAUS3NHX2),Y,none
"Cole Haan Men's Grand Atlantic Textured Sneaker, British Tan Madeira/Silver Birch, 7",,,,,,$247.25,,,,B0BPX179S4,196414262629,196414262629,B0BPX2W233,Cole Haan,,,Y,none
"Cole Haan Women's Originalgrand Platform Sandals Flat, Dark Cuoio/Ivory, 8 Wide",,,$160.00,,$160.00,$160.00,,,,B0CBCQV3DK,196414424201,196414424201,B0CFZQQZ8C,Cole Haan,,3rd Party (AH1YFAUS3NHX2),Y,none
"Cole Haan Women's Originalgrand Platform Sandals Flat, Black/Black, 10",,,,,,$160.00,,,,B0CBCPW1WT,196414420944,196414420944,B0CFZQQZ8C,Cole Haan,,,Y,none
"Cole Haan Women's Bellport Bow Skimmer Mary Jane Flat, True Red Suede, 9",,,,,,$219.25,,,,B0CBD2F7VD,196414431209,196414431209,B0CBD3X59L,Cole Haan,,,Y,none
"Steve Madden Women's Remmi Heeled Sandal, Gold, 6",,,$79.95,,$79.95,$79.95,,,,B0CKDMNQ6W,198024066611,198024066611,B0CKDCQQZY,Steve Madden,,3rd Party (AH1YFAUS3NHX2),Y,none
"New Balance Women's Fresh Foam EVOZ V2 Running Shoe, Natural Indigo/Light Arctic Grey/Silver Metallic, 7.5",,,,,,$89.99,,,,B09H3PQ9D3,196307427937,196307427937,B096NT2CF4,New Balance,,,Y,none
"Steve Madden Women's Bixby Knee High Boot, Sand Suede, 9",,,$178.30,,$169.99,$199.95,,,,B0CGZL5BMP,197369847770,197369847770,B0C67KNDMX,Steve Madden,,3rd Party (A2OTE410JXLA5O),Y,none
Steve Madden Azzurra Sandal Black 8.5 M,,,$31.06,,$31.06,$31.96,,,,B0C18TXT91,197369078136,197369078136,B0CG6C3PWV,Steve Madden,,3rd Party (A2BMBHD2OU3XDU),Y,none
Steve Madden Azzurra Sandal Natural 6 M,,,$31.48,,$31.48,$32.40,,,,B0C18QSFPQ,197369078044,197369078044,B0CG6C3PWV,Steve Madden,,3rd Party (A2BMBHD2OU3XDU),Y,none
"Steve Madden Women's Sandria Flat Sandal, Black Patent, 9",,,$109.95,,$109.95,$109.95,,,,B0CWN7BQ19,198024445089,198024445089,B0CTDKR535,Steve Madden,,3rd Party (AH1YFAUS3NHX2),Y,none
"Steve Madden Women's Sandria Flat Sandal, Red Patent, 8.5",,,$109.95,,$109.95,$109.95,,,,B0CTD7Q3WD,198024445072,198024445072,B0CTDKR535,Steve Madden,,3rd Party (AH1YFAUS3NHX2),Y,none
"Cole Haan Men's Original Grand Shortwing Oxford, Grey Pinstripe Brush-Off/Silver Birch, 9",,,$169.95,,$169.95,$265.13,,,,B0BPXMDCF5,196414275490,196414275490,B0BPXSYK4M,Cole Haan,,3rd Party (A1C6SHUL08OHRJ),Y,none
"New Balance Women's Power X Bra 20, Nb Burgundy, X-Large (D-DD)",,,$49.99,,$48.62,$64.99,,,,B0BK1RP2C6,196652767771,196652767771,B0C3KFC37J,New Balance,,3rd Party (A2ZI5FXEJHBJ3H),Y,none
"Cole Haan Men's Grand Laser Bit Driver Driving Style Loafer, Irish Coffee Nubuck/Truffle, 11 Wide",,,$166.37,,$166.37,$234.99,,,,B0CB9G626J,196414453980,196414453980,B0CB9JTPJF,Cole Haan,,3rd Party (AJNSDDEKL0MDQ),Y,none
"Cole Haan Men's Grandpro Ashland Sneaker, Navy Blazer/Microchip, 7.5",,,,,$179.95,$183.95,,,,B0BPX4MWNC,196414314663,196414314663,B0BPXHXHG6,Cole Haan,,,Y,none
"New Balance Men's Minimus TR V1 BOA Cross Trainer, White/Black, 12 Wide",,,$149.99,,$149.99,$149.99,,,,B0C34FSQR8,197375605159,197375605159,B0C35GZNM3,New Balance,,3rd Party (AH1YFAUS3NHX2),Y,none
"Cole Haan Men's Grand+ Wingtip Oxfords, Irish Coffee Nubuck/Tornado, 10",,,$90.00,,$90.00,$90.00,,,,B0CB9H1BCK,196414491012,196414491012,B0CPFBNVJX,Cole Haan,,3rd Party (AH1YFAUS3NHX2),Y,none
"New Balance Boys' T-Shirt - 2 Pack Short Sleeve Active Performance Tee Dry Fit Shirt for Boys (4-20), Size 8, Heather GreyBlack",,,$22.95,,$22.95,$22.95,,,,B0CJ1721GQ,195187853959,195187853959,B08ZJQ7P2F,New Balance,,3rd Party (A2AFJ1SJWF3R1X),Y,none
"Cole Haan Women's Grand Crosscourt Medow Runner Sneaker, Birch/Nylon Natural Tan/Tangerine Suede, 10.5",,,$99.95,,$99.95,$149.99,,,,B0BQ1D2MVN,196414285703,196414285703,B0BQ19PHG3,Cole Haan,,3rd Party (A1EA4W4NX7SS7Y),Y,none
"Cole Haan Men's Zerogrand Remastered Wing Tip Oxford Lined, Sesame/Dark Chocolate/Ivory, 8 Wide",,,$209.95,,$209.95,$209.95,,,,B0CB9FRVR6,196414449280,196414449280,B0D1KYKS27,Cole Haan,,3rd Party (AH1YFAUS3NHX2),Y,none
"Cole Haan Men's Zerogrand Remastered Wing Tip Oxford Lined, Sesame/Dark Chocolate/Ivory, 13 Wide",,,$209.95,,$209.95,$209.95,,,,B0CB9GFKQJ,196414449259,196414449259,B0D1KYKS27,Cole Haan,,3rd Party (AH1YFAUS3NHX2),Y,none
"Cole Haan Men's Zerogrand Remastered Wing Tip Oxford Lined, Natural/Truffle/Cloud Blue, 10.5 Wide",,,$209.95,,$209.95,$209.95,,,,B0CB9HBBTK,196414450507,196414450507,B0D1KYKS27,Cole Haan,,3rd Party (AH1YFAUS3NHX2),Y,none
"New Balance Boys Active Shorts 4 Pack Performance Mesh Basketball Shorts Workout Gym Shorts for Boys (4-20), Size 18-20, Team RedGreen Navy",,,$47.99,,$47.99,$47.99,,,,B0CJ184VNL,195187854864,195187854864,B0CQRGR9RC,New Balance,,3rd Party (A2AFJ1SJWF3R1X),Y,none
"Cole Haan Men's Grand+ Dress Cap Toe Oxford, Black, 8 Wide",,,$99.95,,$99.95,$99.95,,,,B0BQ63VQ4R,196414147131,196414147131,B0BQ5V49HF,Cole Haan,,3rd Party (A1BNXE6U3W2NOH),Y,none
"Cole Haan Women's Bellport Bow Skimmer Mary Jane Flat, True Red Suede, 5",,,$200.55,,$192.60,$219.25,,,,B0CBD1NXP4,196414431124,196414431124,B0CBD3X59L,Cole Haan,,3rd Party (A39WWGXFOLEB1L),Y,none
"Cole Haan Men's Modern Essentials Plain Toe Ox Oxford, Black, 9.5 Wide",,,$154.63,,$154.63,$170.00,,,,B0BPXQMWPW,196414313383,196414313383,B0CTTVHHRJ,Cole Haan,,3rd Party (AH1YFAUS3NHX2),Y,none
"Steve Madden Women's Carrson Heeled Sandal, Mauve Suede, 10.5",,,,,,,,,,B005BAW2OG,829105137387,829105137387,B019D2YXS0,Steve Madden,,,Y,none
"Cole Haan Women's Cloudfeel Hampton Sandals Espadrille Wedge, Soft Gold Leather/Natural Canvas, 8.5",,,,,,$170.00,,,,B0CBCQMCCZ,196414494822,196414494822,B0CFZW4FZN,Cole Haan,,,Y,none
Cole Haan Cloudfeel Espadrille Wedge Sandal 75 mm Denim Jacquard 8.5 B (M),,,$146.85,,$134.00,$165.00,,,,B0BYX28HWJ,196414192193,196414192193,B0CTDW5BZX,Cole Haan,,3rd Party (A24V851RG6UNB7),Y,none
"New Balance Boys Active Shorts 4 Pack Performance Mesh Basketball Shorts Workout Gym Shorts for Boys (4-20), Size 8, Team RedGreen Navy",,,$52.99,,$52.99,$52.99,,,,B0CJ1BDZYS,195187854833,195187854833,B0CQRGR9RC,New Balance,,3rd Party (A2AFJ1SJWF3R1X),Y,none
"Cole Haan Women's Bellport Bow Driver Driving Style Loafer, Pecan Leather, 8",,,,,,$150.00,,,,B0CBD12GDB,196414441253,196414441253,B0CBD5MZ6C,Cole Haan,,,Y,none
"Cole Haan Men's Grand+ Wingtip Oxfords, Irish Coffee Nubuck/Tornado, 7",,,$90.00,,$90.00,$90.00,,,,B0CB9FDQ6T,196414491074,196414491074,B0CPFBNVJX,Cole Haan,,3rd Party (AH1YFAUS3NHX2),Y,none
"Cole Haan Men's Grand+ Dress Cap Toe Oxford, British Tan, 9 Wide",,,$99.95,,$99.95,$99.95,,,,B0BQ5NB9SS,196414146004,196414146004,B0BQ5V49HF,Cole Haan,,3rd Party (A1BNXE6U3W2NOH),Y,none
"New Balance Men's Minimus TR V1 BOA Cross Trainer, White/Black, 13",,,$149.99,,$149.99,$149.99,,,,B0C34GTK43,197375605012,197375605012,B0C35GZNM3,New Balance,,3rd Party (AH1YFAUS3NHX2),Y,none
"New Balance Men's Minimus TR V1 BOA Cross Trainer, White/Black, 11 Wide",,,$149.99,,$149.99,$149.99,,,,B0C34GJZ4T,197375605135,197375605135,B0C35GZNM3,New Balance,,3rd Party (AH1YFAUS3NHX2),Y,none
"Cole Haan Men's Grand Atlantic Textured Sneaker, British Tan Madeira/Silver Birch, 11",,,$105.53,,$105.53,$210.00,,,,B0BPX7CZBS,196414262582,196414262582,B0BPX2W233,Cole Haan,,3rd Party (A1LEM297LNF1FK),Y,none
"Cole Haan Women's Lx Pinch Penny Loafer, Blue Denim/Natural, 6",,,,,,$200.00,,,,B0C4WCSKYX,196414338317,196414338317,B0C4WJ3Q4X,Cole Haan,,,Y,none
Cole Haan Men's C37891 - Amercn Class Pny Lfr 8.5 W,,,$134.14,,$134.14,$157.95,,,,B0CP2WQG8D,196414216004,196414216004,B0BVGWLGFR,Cole Haan,,3rd Party (AUTFUZM21LT4F),Y,none
Cole Haan American Classics Penny Loafer Truffle Nubuck/Egret 11 W - Wide,,,$95.97,,$95.97,$191.94,,,,B0BST3C3JP,196414127218,196414127218,B0BVGWLGFR,Cole Haan,,3rd Party (A1BNXE6U3W2NOH),Y,none
"Steve Madden Jungle Natural Block Heel Slip On Open Toe Fashion Heeled Sandals (Natural Cork, 9)",,,$56.24,,$51.29,$69.99,,,,B0C4M5YB55,196829558058,196829558058,B0B6GPM743,Steve Madden,,3rd Party (A1G9RBEK6CB71F),Y,none
"Steve Madden Unique Multi Strappy Tie Up Stiletto Heel Open Toe Heeled Sandals (Multi, 8.5)",,,$29.99,,$29.99,$49.99,,,,B0C9KMVVT2,196829621110,196829621110,B0C9KN6TNB,Steve Madden,,3rd Party (A1G9RBEK6CB71F),Y,none
"Cole Haan Women's Chain Heeled Sandal, Soft Gold Leather, 6",,,$124.95,,$124.95,$125.00,,,,B0CBCR2JKM,196414436921,196414436921,B0CFZH8RQ7,Cole Haan,,3rd Party (A1EA4W4NX7SS7Y),Y,none
New Balance Fresh Foam Hierro v6 Sulphur Yellow/Trek 9.5 B (M),,,,,$215.39,$250.57,,,,B0946TPB7S,195481381417,195481381417,B092T1DVGQ,New Balance,,,Y,none
New Balance Fresh Foam Hierro v6 Sulphur Yellow/Trek 10 D - Wide,,,$119.95,,$119.95,$184.46,,,,B0946VPW7K,195481381561,195481381561,B092T1DVGQ,New Balance,,3rd Party (A1Q1PHSVIGZBP8),Y,none
"Steve Madden Girls' Shirt - Casual Short Sleeve Fashion Logo T-Shirt for Girls - Kids' Graphic Tee - Youth Top (4-16), Size 6X, Turbulence",,,$9.95,,$9.95,$16.95,,,,B0CL8B1GLL,886785795894,886785795894,B0CL7XCX1G,Steve Madden,,3rd Party (A3PZV6ZWT70VF6),Y,none
"Steve Madden Girls' Shirt - Casual Short Sleeve Fashion Logo T-Shirt for Girls - Kids' Graphic Tee - Youth Top (4-16), Size 4, Turbulence",,,$9.95,,$9.95,$16.95,,,,B0CL7Z27Q6,886785795863,886785795863,B0CL7XCX1G,Steve Madden,,3rd Party (A3PZV6ZWT70VF6),Y,none
"Steve Madden Girls' Shirt - Casual Short Sleeve Fashion Logo T-Shirt for Girls - Kids' Graphic Tee - Youth Top (4-16), Size 4, Medium Grey",,,$9.95,,$9.95,$16.95,,,,B0CL8DWF67,886785795740,886785795740,B0CL7XCX1G,Steve Madden,,3rd Party (A3PZV6ZWT70VF6),Y,none
"Steve Madden Girls' Shirt - Casual Short Sleeve Fashion Logo T-Shirt for Girls - Kids' Graphic Tee - Youth Top (4-16), Size 7, Turbulence",,,$9.95,,$9.95,$16.95,,,,B0CL7YCJGS,886785795948,886785795948,B0CL7XCX1G,Steve Madden,,3rd Party (A3PZV6ZWT70VF6),Y,none
"Steve Madden Girls' Shirt - Casual Short Sleeve Fashion Logo T-Shirt for Girls - Kids' Graphic Tee - Youth Top (4-16), Size 6X, Grape Leaf",,,$9.95,,$9.95,$16.95,,,,B0CL7XYJHF,886785795856,886785795856,B0CL7XCX1G,Steve Madden,,3rd Party (A3PZV6ZWT70VF6),Y,none
"Cole Haan Men's Grand+ Dress Chelsea Boot, Black, 10",,,$119.95,,$119.95,$149.95,,,,B0BPW4LRJM,196414316773,196414316773,B0BPWHWMHX,Cole Haan,,3rd Party (A1EA4W4NX7SS7Y),Y,none
"Steve Madden Women's Linza Mule, Red Satin, 7.5",,,,,,$99.95,,,,B0C5JVZWM9,197369573778,197369573778,B0C5K35X7Q,Steve Madden,,,Y,none
"Steve Madden Elegant Black Satin Stiletto Heel Pointed Toe Rhinestone Bow Bootie (Black Satin, 6.5)",,,$49.95,,$49.95,$109.95,,,,B0BR4GCH1G,196829180129,196829180129,B089NPW1YG,Steve Madden,,3rd Party (A1G9RBEK6CB71F),Y,none
"Cole Haan Men's Grand+ Dress Chelsea Boot, Black, 10.5",,,,,,$143.94,,,,B0BPWJPGLZ,196414316780,196414316780,B0BPWHWMHX,Cole Haan,,,Y,none
"New Balance Men's 574 V2 Sneaker, Thunder/Team Red, 4.5 Wide",,,$58.99,,$58.99,$79.99,,,,B07RL5QS8D,194182417098,194182417098,B0C3PPPMNS,New Balance,,3rd Party (A3ULBAUHBP8XQ8),Y,none
"Cole Haan Men's ORIGINALGRAND Ultra Wing OX Oxford, Monks Robe/Pumice Stone-Ivory, 11.5 Wide",,,$197.99,,$197.99,$197.99,,,,B07VMGW997,192004776613,192004776613,B0CPJS6BS6,Cole Haan,,3rd Party (AE60DXUTMRRDB),Y,none
"New Balance - Women's Sneakers 327, White Lilac, 7.5 US",,,$321.50,,$321.50,$369.00,,,,B0937KLKPZ,194768772450,194768772450,B0CK64GD2N,New Balance,,3rd Party (A2O4XN2BBGRDQ),Y,none
"New Balance Men's 237 V1 Sneaker, Raincloud/Reflection/Vintage Teal, 11.5",,,,,$104.34,$130.19,,,,B0BJ7LZ3F2,196941321776,196941321776,B0D26DG1P3,New Balance,,,Y,none
"Cole Haan Men's Grand Laser Bit Driver Driving Style Loafer, Irish Coffee Nubuck/Truffle, 9.5 Wide",,,,,$166.37,$234.99,,,,B0CB9G6XFC,196414454079,196414454079,B0CB9HFJDG,Cole Haan,,,Y,none
"Cole Haan Men's Grand Laser Bit Driver Driving Style Loafer, Irish Coffee Nubuck/Truffle, 12 Wide",,,$166.37,,$166.37,$234.99,,,,B0CB9DYZ44,196414454000,196414454000,B0CB9HFJDG,Cole Haan,,3rd Party (AJNSDDEKL0MDQ),Y,none
"Steve Madden Women's Carrson Heeled Sandal, Chalky Pink, 9",,,,,,$89.95,,,,B07WJYVNN3,194068080750,194068080750,B019D2YXS0,Steve Madden,,,Y,none
"Cole Haan Men's Grandpro Topspin Sneaker, Acorn/Trellis/Sesame, 7",,,$174.95,,$174.95,$177.95,,,,B0CB9DN1NZ,196414474701,196414474701,B0CB9K4PLP,Cole Haan,,3rd Party (A1C6SHUL08OHRJ),Y,none
Steve Madden Azzurra Sandal Natural 7 M,,,$31.48,,$31.48,$32.40,,,,B0C18RTWSY,197369078082,197369078082,B0CG6C3PWV,Steve Madden,,3rd Party (A2BMBHD2OU3XDU),Y,none
"Cole Haan Men's Grand Laser Bit Driver Driving Style Loafer, Irish Coffee Nubuck/Truffle, 11",,,,,$166.37,$234.99,,,,B0CB9GB5GJ,196414453867,196414453867,B0CB9HFJDG,Cole Haan,,,Y,none
"Cole Haan Men's Grand Laser Bit Driver Driving Style Loafer, Irish Coffee Nubuck/Truffle, 9",,,,,$166.37,$234.99,,,,B0CB9J1Y1N,196414453942,196414453942,B0CB9HFJDG,Cole Haan,,,Y,none
"Cole Haan Men's Grand Laser Bit Driver Driving Style Loafer, Irish Coffee Nubuck/Truffle, 10 Wide",,,,,$166.37,$234.99,,,,B0CB9FT9DS,196414453966,196414453966,B0CB9HFJDG,Cole Haan,,,Y,none
"Cole Haan Men's Grand Laser Bit Driver Driving Style Loafer, Navy Blazer/Black, 10 Wide",,,,,$125.27,$174.59,,,,B0CB9GWLD5,196414454444,196414454444,B0CB9HFJDG,Cole Haan,,,Y,none
Steve Madden Azzurra Sandal Natural 10 M,,,$31.48,,$31.48,$32.40,,,,B0C18QWD58,197369078204,197369078204,B0CG6C3PWV,Steve Madden,,3rd Party (A2BMBHD2OU3XDU),Y,none
Steve Madden Azzurra Sandal Natural 8.5 M,,,$31.48,,$31.48,$32.40,,,,B0C18RDH8N,197369078143,197369078143,B0CG6C3PWV,Steve Madden,,3rd Party (A2BMBHD2OU3XDU),Y,none
"Cole Haan Women's Vandam Sling Pump 65, Natural Raffia, 10",,,$150.00,,$150.00,$150.00,,,,B0C4WFLP45,196414402650,196414402650,B0BQ1RMHV6,Cole Haan,,3rd Party (APV6T4RKTKPW0),Y,none
"Cole Haan Women's Addie Strappy Sandals Heeled, Camelia Rose Leather, 8.5",,,,,,$99.99,,,,B0CBCSQ2KK,196414429633,196414429633,B0CG117ZR3,Cole Haan,,,Y,none
"New Balance Coco CG1 Tennis Shoes White/Purple Fade US Men's 9.5, Women's 11 Wide",,,,,,$169.99,,,,B0CN33GXS1,197375541938,197375541938,B0CN3HJ4VK,New Balance,,,Y,none
New Balance Baby Boy's Fresh Foam 650v1 Bungee Lace with Top Strap (Infant/Toddler) Magnet/Neo Flame 6 Toddler XW,,,$41.76,,$41.76,$44.99,,,,B0BNXC8BNV,196652104323,196652104323,B0BPYL3GGT,New Balance,,3rd Party (AH1YFAUS3NHX2),Y,none
"New Balance Women's Fresh Foam Roav V1 Running Shoe, Blacktop/Gum, 9",,,,,$100.11,$129.99,,,,B09XRG65KK,196432783434,196432783434,,New Balance,,,Y,none
